{
  "$schema": "http://json-schema.org/draft-07/schema#",
  "title": "Prompt",
  "type": "object",
  "required": ["id", "name", "content", "createdAt", "updatedAt"],
  "properties": {
    "id": { "type": "string" },
    "name": { "type": "string" },
    "description": { "type": "string" },
    "content": { "type": "string" },
    "isTemplate": { "type": "boolean" },
    "variables": {
      "type": ["array", "null"],
      "items": { "type": ["string", "object"] }
    },
    "tags": {
      "type": ["array", "null"],
      "items": { "type": "string" }
    },
    "category": { "type": "string" },
    "createdAt": { "type": "string", "format": "date-time" },
    "updatedAt": { "type": "string", "format": "date-time" },
    "version": { "type": ["integer", "null"] },
    "metadata": { "type": ["object", "null"] }
  },
  "additionalProperties": true
}
